	fullname	id	likes	replies	retweets	text	timestamp	url	user	sentiment score
95	COUNTRY GIRL	945806426152112128	0	0	0	It’s so obvious how much hate you have for President Trump it’s a sickness, you don’t matter anyway @POTUShttps://twitter.com/bettemidler/status/945804985098436609 …	2017-12-26 23:59:58	/ZiggyinHeavon/status/945806426152112128	ZiggyinHeavon	-0.4
96	REAL NEWS FAKE PREZ	945806425355251712	0	0	0	so 2 indictments. 2 guilty pleas.  ALL team trump. Huh.	2017-12-26 23:59:58	/PaineFan01/status/945806425355251714	PaineFan01	-0.5
97	Sadie Omalley	945806423975395328	0	0	0	I read this as 'Trump raises Nazis'. Still works.	2017-12-26 23:59:58	/OMalley_HG/status/945806423975395329	OMalley_HG	0.0
98	Rex John	945806423589400576	0	0	0	Yes.  And now that Trump has single-handedly put Christ back in Christmas, do you suppose we could put Christ back in Christianity?  Then perhaps we could all tolerate it too.	2017-12-26 23:59:58	/spindocRJ/status/945806423589400576	spindocRJ	0.0
99	glenda george	945806420858961920	0	0	0	I trust you for being a good Trump supporters it seems I was wrong.What happened to you for going against the president	2017-12-26 23:59:57	/sofiegeorge/status/945806420858961920	sofiegeorge	0.7
100	Adrian Ashby	945806420418719744	0	1	0	I think your comment goes for all countries. Trump certainly treats woman like 2nd class citizens. gtab em by the pussy  handgun deaths in USA exceeded 12,000 this year. you ok with that?	2017-12-26 23:59:57	/AshbyAdrian/status/945806420418719745	AshbyAdrian	0.2380952380952381
101	Deborah Von Brod	945806418824740864	0	0	0	"Does this sound familiar?
Time to take Trump to court! pic.twitter.com/6A2jV2wnaO"	2017-12-26 23:59:57	/DeborahVonBrod/status/945806418824740864	DeborahVonBrod	0.434375
102	Dead Money	945806418174758912	0	0	0	At least we have some areas of agreement.  Not to mention I used to have three wonderful cats, Annie, Sammy and Tiffany.  But I will apologize for my nasty tone in my first tweet; not my politics.  And I know for a fact that Donald Trump is the farthest thing from racist.	2017-12-26 23:59:56	/CardDead1/status/945806418174758914	CardDead1	-0.012500000000000011
103	Ian Traverse	945806417839230976	0	0	0	There is simply no meaningful comparison between Churchill and Trump. For a start one of them isn’t statesman like. Teaser,  it’s not Churchill. https://twitter.com/MrBrendanCox/status/945776152878174209 …	2017-12-26 23:59:56	/F9Shift/status/945806417839230978	F9Shift	-0.25
104	Joe Deegan	945806417382068224	0	0	0	Holiday Shopping Data Illustrate Success of Trump's Policies and Democrats' Difficult Road https://fb.me/CFCa6y2p 	2017-12-26 23:59:56	/JoeClarkDeegan/status/945806417382068224	JoeClarkDeegan	-0.1
105	HarunMaruf Polls	945806416740323328	16	8	17	Poll: There were so many international news stories this year - from hurricanes to London's Grenfell Tower fire, fall of Raqqa, presidential elections, Trump's Jerusalem decision and many others. I chose these 4 stories! Please vote or just reply with your other pick!	2017-12-26 23:59:56	/HarunMarufPolls/status/945806416740323335	HarunMarufPolls	0.2421875
106	Jorge Garcia	945806414068506624	1	0	0	Isn’t it great to have one day after another, because, one day we will wake up and the headline will be TRUMP IS OUT -or TRUMP RESIGNED -or TRUMP IS HEADING TO JAIL -or TRUMP SUFFERED GREATEST LOSS or TRUMP& FAMILY INDICTED. PATIENCE IS A VIRTUE !  We will see one of them.	2017-12-26 23:59:56	/jorgelgarcia33/status/945806414068506624	jorgelgarcia33	0.5666666666666668
107	Michael Quintos	945806411908435968	0	0	0	The Trump administration is scaling back fines against nursing homes that harm residents or place them in grave risk of injury https://nyti.ms/2pt7EsQ 	2017-12-26 23:59:55	/mquintos/status/945806411908435968	mquintos	0.0
108	Donna	945806411128299520	0	0	0	@GovMikeHuckabee Are u insane!  trump is a petulant 2 year old toddler.  He’s this nation’s first subhuman President. https://twitter.com/govmikehuckabee/status/945739713138315264 …	2017-12-26 23:59:55	/Donna_DHKBB/status/945806411128299521	Donna_DHKBB	-0.21666666666666667
109	Susan Petrucelli	945806409094057984	0	0	0	China Erects A Trump Statue For The New Year http://dailycaller.com/2017/12/26/china-erects-a-trump-statue-for-the-new-year/?utm_source=site-share … via @dailycaller	2017-12-26 23:59:54	/Petch9415Susan/status/945806409094057984	Petch9415Susan	0.13636363636363635
110	USA Liberty News	945806407051501568	0	0	0	"Chris Matthews Confused Why 'Regular' Republicans Support Trump's Tax Cuts: 'Why Did They Vote This Way?'
 http://libertyrednews.com/chris-matthews-confused-regular-republicans-support-trumps-tax-cuts-vote-way/ …"	2017-12-26 23:59:54	/UsaLibertyNews/status/945806407051501568	UsaLibertyNews	-0.2
111	 🇺🇲Cavalry_Scout.45mm 🔫	953054186454822912	45	9	18	"Maxine Waters boycotting Trump's State of the Union address....

I'm sure everyone is broken hearted to not be graced by her presence.

Wake up silly Democrats, Trump don't care and most importantly... The people don't care. We only care about hearing Trump's plan to #MAGA2018!!!"	2018-01-15 23:59:59	/Deacon_1971/status/953054186454822913	Deacon_1971	0.08333333333333333
112	James Madison	953054185716682752	3	2	2	If known Liar Little Dicky Durbin actually wanted a deal on DACA.... the flaccid nincompoop wouldnt have ran to the press right after the closed door meeting to lie his arse off.  Democrats dont want a deal because they dont want Trump or the USA to win on anything.	2018-01-15 23:59:59	/JamessMadison/status/953054185716682752	JamessMadison	0.15964285714285714
113	Jan Erickson	953054183917342720	0	0	1	Donald Trump adds 'treason' to smear of FBI http://www.msnbc.com/rachel-maddow/watch/donald-trump-adds-treason-to-smear-of-fbi-1135290435602 …	2018-01-15 23:59:58	/Mistress_Jan/status/953054183917342721	Mistress_Jan	0.0
114	Christian A.K.A =            ⭕️Sub-Zero ⭕️	953054182252122112	0	0	0	Really Mr. Trump? Hmm, I think those words should come out of someone t that respect culture, race and color. Someone that sees one nation under god. Not someone that supports diversity and hatred towards different race and color. We come from “shitholes” right? Just don’t	2018-01-15 23:59:58	/SubZer0u/status/953054182252122114	SubZer0u	0.1619047619047619
115	LUPIN	953054182134697984	0	0	0	Donal J Trump is a RACIST LIAR. @POTUS @realDonaldTrump	2018-01-15 23:59:58	/Skiridr/status/953054182134697984	Skiridr	0.0
116	CNN PIECE OF SH 💩T  ◾	953054182113767424	0	0	0	"#MAGA #MLKDay #Trump #AmericaFirst #DrainTheSwamp #TrumpTrain #Trump2020 
󾓦󾓦󾓦󾓦󾓦󾓦󾓦󾓦󾓦󾓦https://twitter.com/renomarky/status/953052101353115648 …"	2018-01-15 23:59:58	/renomarky/status/953054182113767424	renomarky	0.0
117	JeFfErSoN (ⓢⓔⓟ 🦂)	953054182105378816	5	0	3	Tem que postar tudo no twitter do Donald Trump pq assim ele sabe a real de tudo dito pelo povo ñ pela bosta da imprensa .	2018-01-15 23:59:58	/jrvsnp/status/953054182105378817	jrvsnp	0.2
118	MWatsonTX	953054180792590336	7	2	3	Trump got by with it and was able to run for POTUS by refusing to show American voters his tax returns. Whereas, HRC revealed 30-years of tax returns. We MUST change state & federal laws now to require all future POTUS & VP candidates to release multiple years of tax returns! https://twitter.com/mppmaddog/status/952965157197631488 …	2018-01-15 23:59:58	/MWatsonTX/status/953054180792590337	MWatsonTX	0.125
119	Alfred	953054178246582272	0	0	0	Good because it would be a embarrassment for Trump to be seen with you	2018-01-15 23:59:57	/Alfred92808994/status/953054178246582272	Alfred92808994	0.7
120	Shamika Daniel	953054177873268736	0	1	0	I really want Trump to end up in jail!!!!!’	2018-01-15 23:59:57	/DanielShamika/status/953054177873268736	DanielShamika	-0.052587890624999994
121	Justice Seeker  ✊🏼 💥	953054175453241344	105	5	62	"Nixon - “I am not a crook.”
tRump - “I am not a racist.” pic.twitter.com/cKQz8FHjOf"	2018-01-15 23:59:56	/tizzywoman/status/953054175453241349	tizzywoman	0.0
122	Hypnotic Studios	953054175335796736	0	1	0	Record high and it keeps going up but i am not racist because i like trump i have a ton of Mexican, black, white, indian, native friends that i talk to daily so how am I racist I don't see my self better than anyone else because im white	2018-01-15 23:59:56	/HypnoticDZN/status/953054175335796737	HypnoticDZN	0.07047619047619048
123	 ♦️ Denise Nichole  ♦️	953054175226507264	0	0	0	Trump is not part of the establishment and if he succeeds, the establishment will never win again, you see, he is a threat to the establishment because they fear a united America, that gives control back to the people and they don’t want that #Facts	2018-01-15 23:59:56	/allabouttrump/status/953054175226507264	allabouttrump	0.09999999999999998
124	Joyce Lawton	953054175134408704	0	0	0	the Trump probably has more words, better words, bigger words...	2018-01-15 23:59:56	/ponymom48/status/953054175134408704	ponymom48	0.3333333333333333
125	Wendy Hirschegger	953054174152859648	2	0	0	Actually, just being in #shitholepresident trump's presence would be enough to sicken people! But, in any case, LMFAO!!! https://twitter.com/kylegriffin1/status/953051758342918144 …	2018-01-15 23:59:56	/hirschw1/status/953054174152859648	hirschw1	0.0
126	Sarah	953054174060732416	0	0	0	"first she's bad for not supporting trump now she's a ""fake feminist"" these trolls are dumb as hell"	2018-01-15 23:59:56	/fisharnolds/status/953054174060732417	fisharnolds	-0.2899999999999999
127	DIYPOTUS	953054173913903104	0	0	0	LeBron James says Donald Trump has allowed racists to operate without fear - http://bit.ly/2DCz1E7  - #USPolitics #trump #potus	2018-01-15 23:59:56	/diypotus/status/953054173913903104	diypotus	0.0
128	vlh	953054172475154432	0	0	0	Trump the great deal maker isn't smarter then a fifth grader to make a DACA deal w Democrats. The Trump plan. pic.twitter.com/ivR8ljFv4W	2018-01-15 23:59:56	/coton_luver/status/953054172475154432	coton_luver	0.8
129	Stealth Jeff	953054172441661440	573	10	273	At the very least, they need to manufacture a scandal so bad it will cripple the incoming Trump administration and render it ineffective in fomenting any real change to policy - or the uncovering of Obama/HRC/DOJ/FBI criminal activity.	2018-01-15 23:59:56	/drawandstrike/status/953054172441661440	drawandstrike	-0.3225
130	Tom Geoghegan	953054171443449856	0	0	0	'Those damn tweets'... four Trump voters grade the president's first year http://www.bbc.com/news/av/world-us-canada-42694879/trump-voters-grade-president-s-first-year …	2018-01-15 23:59:56	/tom_geoghegan/status/953054171443449856	tom_geoghegan	0.25
131	Infonya Mas	837090071085985792	0	0	0	Saham Wall Street Melonjak Setelah Pidato Trump di Kongres http://blog.sekseeh.com/berita/saham-wall-street-melonjak-setelah-pidato-trump-di-kongres/ …pic.twitter.com/yx7wbUapcK	2017-03-01 23:59:59	/Infonya_Mas/status/837090071085985798	Infonya_Mas	0.0
132	Donna Brazile	837011231055704064	1418	299	702	We must never normalize those who peddle lies and misinformation. CNN drooled all over Trump’s speech.  https://newrepublic.com/minutes/141039/cnn-drooled-trumps-speech ….	2017-03-01 18:46:43	/donnabrazile/status/837011231055704066	donnabrazile	0.0
133	Steve Kopack	837084933071962112	1391	62	825	"NBC: *TEN* sr officials from across govt say that no valuable intel has come from Yemen raid so far

Last night, Trump said the opposite"	2017-03-01 23:39:34	/SteveKopack/status/837084933071962112	SteveKopack	0.025
134	tim aquino	837090070427537408	0	0	0	i think you're at the trump tower by columbus circle. right or wrong? :)	2017-03-01 23:59:59	/timaq/status/837090070427537408	timaq	0.09523809523809523
135	Rula Jebreal	836813513653907456	94	7	54	Contrary to Trump’s claimes, immigrants are less likely to commit crimes, yet, @POTUS keeps repeating that Lie.https://nyti.ms/2k8PNU0 	2017-03-01 05:41:03	/rulajebreal/status/836813513653907457	rulajebreal	-0.08333333333333333
136	John Nichols	837063777547927552	104	8	53	"Trump's ratings? SAD

Obama 1st speech to Congress: 52.4M viewers
Trump 1st speech to Congress: 43M viewers https://www.google.com/amp/www.hollywoodreporter.com/amp/live-feed/tv-ratings-trumps-congress-address-falls-comparable-obama-speech-981881 …"	2017-03-01 22:15:31	/NicholsUprising/status/837063777547927553	NicholsUprising	-0.5
137	Detector de Mentiras	837087444600258560	71	5	106	El estudio que usó Trump para atacar a los inmigrantes dice en verdad que la inmigración es buena para la economía http://uni.vi/7slV309uO2l pic.twitter.com/i8x0HC3hA2	2017-03-01 23:49:33	/detecdementiras/status/837087444600258561	detecdementiras	0.0
138	Ann Coulter	837083428306694144	20418	580	6311	CNN: After speech, 7 in 10 said Trump's policies will move country in right direction. The other 3 were CNN reporters.	2017-03-01 23:33:36	/AnnCoulter/status/837083428306694145	AnnCoulter	0.08035714285714285
139	Sophi Frost	837090069819293696	0	0	1	Deomcratic response to Trump's speech: He's 'Wall Street's champion' @CNNPoliticshttp://cnn.it/2m5SUg5 	2017-03-01 23:59:59	/SophiFrost/status/837090069819293697	SophiFrost	0.0
140	antonio	791740370631569408	20847	46	9118	14. me when i see trump supporters https://vine.co/v/i5ABOrTUHqX 	2016-10-27 20:36:28	/antoniodelotero/status/791740370631569412	antoniodelotero	0.0
141	Damian Pachter	837086449006743552	12	1	23	[2] Esto significa un golpe demoledor para la organización sunita y un triunfo táctico para el presidente Trump.	2017-03-01 23:45:36	/damianpachter/status/837086449006743552	damianpachter	0.0
142	RITA	837090068955344896	0	0	0	Trump cambia estilo y exhibe un inédito tono presidencial ante el Congreso http://www.latercera.com/noticia/trump-cambia-estilo-exhibe-inedito-tono-presidencial-ante-congreso/ … vía @latercera	2017-03-01 23:59:59	/RITAYULY/status/837090068955344897	RITAYULY	0.0
143	Bradd Jaffy	836765321323298816	17949	441	11725	Trump mentions Boston, San Bernardino, the Pentagon & the World Trade Center. None of those attackers were from countries in his travel ban. pic.twitter.com/cgkcB8YQQc	2017-03-01 02:29:33	/BraddJaffy/status/836765321323298818	BraddJaffy	-0.1
144	tamara	836785452635938816	93	1	61	"""Donald Trump or Mike Pence""  pic.twitter.com/mQkjoK4luj"	2017-03-01 03:49:33	/reverseiris/status/836785452635938816	reverseiris	0.0
145	billy eichner	837056118920736768	5002	114	832	I'm sorry what did Trump do that was so gr8? Imply that all illegal immigrants murder & try 2 change narrative abt a botched fatal mission?	2017-03-01 21:45:05	/billyeichner/status/837056118920736771	billyeichner	-0.5
146	Scott Radley	833118949210460160	1	0	1	New York City Dad Outraged Over Daughter's 'Anti-Trump' Homework Question #MAGA #POTUS #TuckerCarlsonTonight https://youtu.be/ARn6sqMeSdw 	2017-02-19 01:00:10	/MI_RIGHT_SIDE/status/833118949210460165	MI_RIGHT_SIDE	-0.38181818181818183
147	Deanna McGowan	837090068384911360	0	0	0	"""Trump Is Resurrecting t/ Scare Tactics"": Prof. Kelly Lytle Hernández on Trump's Deportation Plans https://www.democracynow.org/2017/3/1/trump_is_resurrecting_the_scare_tactics … via @democracynow"	2017-03-01 23:59:59	/DeannaLee1369/status/837090068384911360	DeannaLee1369	0.0
148	Greg Williams	837090068200321024	0	0	0	@TomPerez People really think DJT makes ties, manages ties, owns tie companies?  The Trump name is licensed to biz's + value	2017-03-01 23:59:59	/GregWil01612948/status/837090068200321024	GregWil01612948	0.2
149	Jeet Heer	837088199767961600	230	12	115	Not content with pissing off the Intelligence Community, Trump is now aiming to alienate military leadership. https://twitter.com/KenDilanianNBC/status/837084047578959873 …	2017-03-01 23:52:33	/HeerJeet/status/837088199767961602	HeerJeet	-0.1
150	Matt Pearce  🦅	837085195949977600	1014	45	1042	"Yesterday, Trump told Congress that the Yemen raid that killed Owens produced ""large amounts of vital intelligence"": https://twitter.com/NBCNightlyNews/status/837083908957167616 …"	2017-03-01 23:40:37	/mattdpearce/status/837085195949977602	mattdpearce	0.03809523809523809
151	Infobae América	895004573441699840	105	11	116	"AHORA | Donald Trump advirtió a Corea del Norte que si aumenta la amenaza nuclear responderá ""con fuego y furia"""	2017-08-08 19:31:33	/InfobaeAmerica/status/895004573441699840	InfobaeAmerica	0.0
152	CNN en Español	895008235899551744	202	70	346	"ÚLTIMA HORA
""Fuego y furia"": la advertencia de Trump a Corea del Norte http://cnn.it/2umwEQy "	2017-08-08 19:46:06	/CNNEE/status/895008235899551745	CNNEE	0.0
153	Claude Taylor	895067316253282304	2698	367	825	"Trump wants war against North Korea so he can point to an ""accomplishment""."	2017-08-08 23:40:52	/TrueFactsStated/status/895067316253282304	TrueFactsStated	0.2
154	Frankie Boyle	895045989647691776	10428	170	3816	Convinced Trump is a Rangers fan. He's had a wee look pre-season and so it's plan b: thermonuclear war	2017-08-08 22:16:07	/frankieboyle/status/895045989647691781	frankieboyle	0.0
155	Christopher Stroop	895060395542622208	188	6	94	3. Robert Jeffress, meanwhile, is a prominent Southern Baptist pastor who is a major Trump supporter and has some contact with Trump.	2017-08-08 23:13:22	/C_Stroop/status/895060395542622208	C_Stroop	0.1875
156	God	895070093687873536	3520	94	1171	Donald of the House Trump, King of the Uneducated, Builder of the Huge Imaginary Wall, Protector of Rednecks, and Father of Fake News.	2017-08-08 23:51:54	/TheGoodGodAbove/status/895070093687873536	TheGoodGodAbove	-0.04999999999999996
157	Laura Moser	895040413563846656	146	563	48	To all responsible Republicans in the Senate: Trump's threats to North Korea are terrifying. It's time to speak up.	2017-08-08 21:53:58	/lcmoser/status/895040413563846656	lcmoser	-0.4
158	Jason Terry	895072128160104448	0	0	0	Why Sanders defeats Trump, but Trump defeats Clinton http://thehill.com/blogs/pundits-blog/presidential-campaign/257704-why-sanders-defeats-trump-but-trump-defeats-clinton#.WYpQSJKK-r8.twitter … I'm sharing this forever and ever !  H.A. was spot on here.	2017-08-08 23:59:59	/jasont42/status/895072128160104454	jasont42	0.0
159	The Hummingbird  🐦	895071423491919872	1034	106	1357	RT if you agree that Trump's reckless rhetoric with North Korea is NOT a joke. It is putting America in real danger. pic.twitter.com/RAK0lAtCkp	2017-08-08 23:57:11	/SaysHummingbird/status/895071423491919872	SaysHummingbird	0.2
160	Kyle Griffin	895051476992753664	1452	92	1069	"House Foreign Affairs RM Eliot Engel: ""Trump's reckless behavior and impulsive outburst undermined the security of the American people."" pic.twitter.com/h9KmbswA1D"	2017-08-08 22:37:56	/kylegriffin1/status/895051476992753664	kylegriffin1	-0.0625
161	Amy Siskind	895029429700894720	8426	372	3115	Media, please stop with the nonsense that Trump has some grand plan for acting irrationally and bullying towards N. Korea. He's just nuts!	2017-08-08 21:10:19	/Amy_Siskind/status/895029429700894721	Amy_Siskind	0.25
162	Alexander Panetta	895041490434609152	1553	24	1005	Periodic reminder: The Trump administration still hasn't appointed diplomats to the region https://twitter.com/brianschatz/status/895036302504087552 …	2017-08-08 21:58:15	/Alex_Panetta/status/895041490434609154	Alex_Panetta	0.0
163	Laurence Tribe	894736625946775552	8235	533	6570	Trump's Sinclair Media Group is taking over local TV stations. A real threat to democracy, however creeping and shadowy. Watch for it!	2017-08-08 01:46:49	/tribelaw/status/894736625946775557	tribelaw	0.125
164	PoliticusUSA	894960414173388800	82	19	186	As His Approval Rating Plummets, Trump Is Supporting A Massive State Level Voter Purge via @politicususa http://www.politicususa.com/2017/08/08/approval-rating-plummets-trump-supporting-massive-state-level-voter-purge.html … #p2 #ctl	2017-08-08 16:36:04	/politicususa/status/894960414173388801	politicususa	0.125
165	Jack Posobiec  🇺🇸	895051737995894784	406	65	205	Trump is weighting option to preemptively strike North Korea nuke launch sites. McMaster has been arguing for this for months	2017-08-08 22:38:58	/JackPosobiec/status/895051737995894785	JackPosobiec	0.0
166	LiberalLou	895072127627350016	0	0	0	"@thehill @rollcall @cspan @speakerboehner @GOPleader @whitehouse @housedemocrats @MoveOn @OccupyDemocrats #trump #trumprussia
#resistpic.twitter.com/DKdVPlSHns"	2017-08-08 23:59:59	/JerashkimBrown/status/895072127627350016	JerashkimBrown	0.0
167	sue hon	895072127581376512	0	0	0	Trump gets a folder full of positive news about himself twice a day https://news.vice.com/story/trump-folder-positive-news-white-house … via @vicenews	2017-08-08 23:59:59	/pudderboy/status/895072127581376512	pudderboy	0.28863636363636364
168	G	895041431492071424	520	8	236	When you see North Korea, World War III, and Trump are all trending... pic.twitter.com/tP8hJUyHZa	2017-08-08 21:58:00	/XGroverX/status/895041431492071424	XGroverX	0.0
169	Facts Do Matter	895025989033578496	319	24	192	"Kim Jong-Trump threatens N. Korea with “fire and fury.” He is starting to make Kim Jong-un look like the sane one.
https://www.nytimes.com/2017/08/08/world/asia/north-korea-un-sanctions-nuclear-missile-united-nations.html?hp&action=click&pgtype=Homepage&clickSource=story-heading&module=first-column-region&region=top-news&WT.nav=top-news …"	2017-08-08 20:56:39	/WilDonnelly/status/895025989033578498	WilDonnelly	0.0
170	AM Joy w/Joy Reid	894960146463338496	898	52	574	Watch @JoyAnnReid guest hosting for @maddow yesterday → #Trump exploits loophole to hire foreign staff http://www.msnbc.com/rachel-maddow/watch/trump-exploits-loophole-to-hire-foreign-workers-at-mar-a-lago-1019565635530 …	2017-08-08 16:35:01	/amjoyshow/status/894960146463338496	amjoyshow	-0.125
171	Should U B In canada	880576614798589952	0	0	0	I wonder what they would say if they were in the same position as Trump	2017-06-29 23:59:59	/move2canada/status/880576614798589953	move2canada	0.0
172	Scott Dworkin	880565497619783680	435	11	335	Vid: Remember that time Trump encouraged violence at his Asheville-NC rally & it led to the arrest of his supporter? https://www.youtube.com/embed/jpWvqDKmSn8 …	2017-06-29 23:15:49	/funder/status/880565497619783681	funder	-0.05
173	Jennifer Rush	880576614504947712	0	0	0	4 Goals for Trump’s European Trip Next Week http://dailysign.al/2tpUnlH  via @FredLucasWH @DailySignal	2017-06-29 23:59:59	/JennRush/status/880576614504947712	JennRush	0.0
174	Joy Reid	880496233319714816	38635	1428	17353	"As a reminder: what Trump felt he simply had to ""hit back"" at, was Mika Brzezinski joking about the fake TIME Magazine cover he made."	2017-06-29 18:40:35	/JoyAnnReid/status/880496233319714819	JoyAnnReid	-0.16666666666666666
175	Jake Tapper	880556121769070592	327	71	106	GOP officeholders slam Trump over tweets http://cnn.it/2tv6Rc8  #TheLead	2017-06-29 22:38:34	/jaketapper/status/880556121769070597	jaketapper	0.0
176	Shaun King	880453773478572032	12365	542	3476	"I will never get used to the fact that our nation elected Donald Trump as President.

It's just so despicable and ridiculous."	2017-06-29 15:51:52	/ShaunKing/status/880453773478572032	ShaunKing	-0.3333333333333333
177	Judd Legum	880495639012016128	13849	288	8410	"""Knock the crap out of them … I promise you, I will pay for the legal fees"" -- Donald Trump https://twitter.com/W7VOA/status/880495298115760128 …"	2017-06-29 18:38:13	/JuddLegum/status/880495639012016129	JuddLegum	-0.30000000000000004
178	Kathy Stabe	880576613091561472	1	0	0	"Donald Trump thinks health insurance costs $15 a month http://shareblue.com/donald-trump-thinks-health-insurance-costs-15-a-month/#.WVWUOrEfYx8.twitter … via @shareblue
Oy @POTUS insurance costs about 20 times more."	2017-06-29 23:59:59	/TXKathy82/status/880576613091561473	TXKathy82	0.5
179	CNN	880576119501705216	2794	793	732	Republican strategist and CNN commentator Ana Narvarro says Trump is  embarrassing, shameful, disgusting http://cnn.it/2sWA1iy pic.twitter.com/vOh59uKuwz	2017-06-29 23:58:01	/CNN/status/880576119501705216	CNN	-1.0
180	America Resurgent	880576613007667200	205	8	14	To Trump allies such as this man who happily allows prisoners to die, the free press is evil.	2017-06-29 23:59:59	/ProgressOutlook/status/880576613007667200	ProgressOutlook	0.050000000000000044
181	IR.net	880575121743859712	23	0	16	BREAKING: Evidence Emerges Of Attempted Collusion Between Trump Campaign & Russia http://ir.net/news/politics/125660/evidence-emerges-attempted-collusion-trump-campaign-russia/ …	2017-06-29 23:54:03	/IRdotnet/status/880575121743859712	IRdotnet	0.0
182	Maxine Waters	880551236805603328	17468	2171	5678	When Trump goes to kiss Putin's ring at the G20 meeting, maybe he should just return to Russia w/ him & their favorite amb. Sergey Kislyak.	2017-06-29 22:19:09	/RepMaxineWaters/status/880551236805603330	RepMaxineWaters	0.5
183	The Associated Press	880574970107187200	17850	450	7554	BREAKING: Hawaii files court challenge to Trump administration's definition of close U.S. relationship needed to avoid travel ban.	2017-06-29 23:53:27	/AP/status/880574970107187200	AP	0.0
184	Bernie Sanders	880571917081694208	5175	608	2805	The Trump-McConnell “health care” bill would slash Medicaid by $2.4 trillion over the next two decades, devastating tens of millions. pic.twitter.com/Zjc7LT8SfO	2017-06-29 23:41:19	/SenSanders/status/880571917081694209	SenSanders	-0.5
185	Scott Dworkin	880484865149464576	5249	100	2850	"GOP Members of Congress—

If you still support Donald Trump, we're going to make sure your voters never forget it.

#TheResistance"	2017-06-29 17:55:25	/funder/status/880484865149464576	funder	0.5
