	fullname	id	likes	replies	retweets	text	timestamp	url	user	sentiment score
0	Kathleen McKinney	938558672342482944	0	0	0	This is awful. Poor ppl. Need to find out more. But I bet Russians are behind it. And it will end up as Trump’s excuse to cut ties w Cubs & prevent US citz from going there. https://twitter.com/nytnational/status/938544094539853824 …	2017-12-06 23:59:59	/Kath_Mckinney/status/938558672342482944	Kath_Mckinney	-0.26999999999999996
1	Cupcake's News	938558671847673856	0	0	0	"► De “histórico” califica Netanyahu la declaración de Trump sobre Jerusalén
 
http://bit.ly/2ksjIsa pic.twitter.com/V2f80PETZy"	2017-12-06 23:59:59	/Cupcakes_News/status/938558671847673856	Cupcakes_News	0.0
2	But Her Emails!	938558670950060032	0	0	0	But her emails!!!!!!!!!!!!!!!!!!!!!! #ButHerEmails #Comey #Clinton #Trump	2017-12-06 23:59:59	/butheremailsbot/status/938558670950060032	butheremailsbot	0.0
3	Ryan Bennett	938558669947572224	0	0	0	Brexit complete.Trump 2nd term.Not 4 words but better than the liberal white noise you're spewing	2017-12-06 23:59:59	/RiperrSB/status/938558669947572224	RiperrSB	0.16666666666666666
4	kyle J.	938558669633007616	0	0	0	Don’t resign until Trump does. https://twitter.com/senfranken/status/938546524283461632 …	2017-12-06 23:59:59	/Kyle_Jennings33/status/938558669633007616	Kyle_Jennings33	0.0
5	Frontera 7 Días	938558668869599232	0	0	0	Trump reconoce a Jerusalén como capital de Israel y los líderes mundiales condenan su… http://www.frontera7dias.com.ve/2017/12/06/trump-reconoce-jerusalen-capital-israel-los-lideres-mundiales-condenan-decision/ …pic.twitter.com/03KOqX4xHK	2017-12-06 23:59:58	/Frontera7dias/status/938558668869599233	Frontera7dias	0.0
6	bangolure	938558668542529536	0	0	0	This also a true statement. All the others did is use in their campaign, It got voted on in the 90's and was postponed.And then every year after that it was postponed again. So it came up again and Trump did what had already been voted on & put it into effect. https://twitter.com/Pink_About_it/status/938455616850456579 …	2017-12-06 23:59:58	/bangolure/status/938558668542529536	bangolure	0.35
7	Greg	938558666734735360	1	0	1	Bullshit!! This is his Dems lose—trying to be pc n bringing a knife to a gunfight. Trump isn’t resigning n Moore’s still running n u want to dump franken?  Even Bernie is on this bs train that got started w a conservative talk show host.	2017-12-06 23:59:58	/gawilson81/status/938558666734735361	gawilson81	0.0
8	Devan	938558666004946944	0	1	0	Exactly. Clinton was held held accountable and impeached. Now it's time for trump's impeachment.	2017-12-06 23:59:58	/MssAnthrope/status/938558666004946944	MssAnthrope	0.25
9	Denver Middle East	938558665874739200	0	0	0	Trump Urges Saudi Arabia to End Blockade of Goods into Yemen https://nyti.ms/2nxDJi9 	2017-12-06 23:59:58	/MiddleEastDU/status/938558665874739200	MiddleEastDU	0.0
10	Hubert Temba Creative Genius	938558665828831232	0	0	0	@SenFranken, Please don't resign. The stakes are too high given what we're facing now as a country, to resign. The GOP Tax Scam and Trump are is a bigger problems. Not all women are believable. E.g. Sarah Palin, Ann Coulter, Sarah Sanders, Kellyanne Conway etc. cc @SenSchumerhttps://twitter.com/senfranken/status/938546524283461632 …	2017-12-06 23:59:58	/HubertTembaMSc/status/938558665828831233	HubertTembaMSc	0.22
11	SmartyPants	938558665753206784	0	0	0	not quite yet... until the storm rains on Trump men think they can slide by too. think of the dozen +/- who are caught... there's probably millions more who know they won't. And another million who HOPE them won't. Trump has to go to court and let's see the truth.	2017-12-06 23:59:58	/goldendebbie/status/938558665753206784	goldendebbie	0.5
12	Crow	938558665308610560	0	0	0	It's not just Trump.  The Republican party just handed Moore 170K.  http://www.al.com/news/index.ssf/2017/12/republican_party_gives_170000.html …	2017-12-06 23:59:58	/sistercrow/status/938558665308610560	sistercrow	0.0
13	Eric Muirhead	938558664402542592	0	0	0	It doesn't matter that it isn't comparable it was bad behavior, and if he stays, the Republicans will point at him as Democratic double standard when we call for Roy Moore to be removed or when we use Trump's predatory behavior as reason for impeachment. It sucks but he has to go	2017-12-06 23:59:57	/emuirhead/status/938558664402542592	emuirhead	-0.24999999999999994
14	The Hiking Guy	938558664297799680	0	0	0	Dems blast Trump for Jerusalem decision despite past support http://www.foxnews.com/politics/2017/12/06/dems-blast-trump-for-jerusalem-decision-despite-past-support.html … via the @FoxNews Android app	2017-12-06 23:59:57	/The_Hiking_Guy/status/938558664297799681	The_Hiking_Guy	-0.25
15	Bruce P. Knight	938558663479975936	60	12	41	Congressional Dems are calling on Al Franken to resign, but are afraid to call for Trump's impeachment. And we wonder why republicans keep cleaning our clocks. Franken will be gone next and Roy Moore will be voting to destroy America. Pathetic and Spineless.	2017-12-06 23:59:57	/brucepknight/status/938558663479975938	brucepknight	-0.45
16	Kimberly A. Woodard	938558663366729728	2	1	0	"Because down in the swamp, Donald “Grab ‘Em By The Pussy” Trump is still in office ***and has endorsed*** Roy “Pull ‘Em Out Of Trig Class and Move On ‘Em In Court” Moore. 

Furthermore, Donald Trump is holding A CAMPAIGN RALLY for pedophile Roy Moore.

#NotNormal #ALSen #alpolhttps://twitter.com/beingkimmietoo/status/938533527062183936 …"	2017-12-06 23:59:57	/BeingKimmieToo/status/938558663366729728	BeingKimmieToo	-0.15555555555555559
17	But Her Emails!	909567644076068864	0	0	0	But her emails!!!!!!!!!!!!!!!!!!!!!!!!!!!!!!!! #ButHerEmails #Comey #Clinton #Trump	2017-09-17 23:59:59	/butheremailsbot/status/909567644076068864	butheremailsbot	0.0
18	Carla Chamorro	909567641244831744	0	0	1	"Trump mocks ‘Rocket Man’ Kim Jong-un as advisers issue warnings

 https://youtu.be/uF7FFov5FQs "	2017-09-17 23:59:59	/CarlaChamorros/status/909567641244831745	CarlaChamorros	0.0
19	Billie Furdyna	909567640561225728	0	0	0	Trump Retweeted A Video From An Anti-Semitic Account Showing Him Hitting Hillary Clinton With A Golf Ball https://www.buzzfeed.com/aliciamelvillesmith/trump-golf-ball-rt?utm_term=.imWMpaAEya#.msV0rBpMbB …	2017-09-17 23:59:59	/BFurdyna/status/909567640561225729	BFurdyna	0.0
20	Jacqueline Susann	909567639244111872	0	0	0	"Retweeted Donald J. Trump (@realDonaldTrump):

We have made more progress in the last nine months against ISIS... http://fb.me/CF2zq2dG "	2017-09-17 23:59:58	/JacquelinSusann/status/909567639244111872	JacquelinSusann	0.25
21	David Hernandez	909567639126757376	1	0	1	Mayweather Calls Out Trump Hysteria #TMT #MAGA #TruthHurts #@realDonaldTrump WESTANDUNITED#DrainIthttps://www.youtube.com/watch?v=6731LIO2LKI&feature=share …	2017-09-17 23:59:58	/masenkrock/status/909567639126757376	masenkrock	0.0
22	Jim Farrell	909567638606696448	4	1	0	I'm shocked I told him his knee pads for Trump was worn out. Never got blocked.	2017-09-17 23:59:58	/_seamusfarrell/status/909567638606696448	_seamusfarrell	-0.7
23	Janet Patti Muller	909567638556131328	1	0	0	and down to less than 5 brain cells from that union.	2017-09-17 23:59:58	/runPattirun/status/909567638556131328	runPattirun	-0.16111111111111112
24	Barbara_I	909567636878458880	0	0	0	Waiting for the opening of the Emmy broadcast because I have a feeling that Stephen Colbert is going to stand up to that pussy Trump.  #Yay	2017-09-17 23:59:58	/Barbara102006/status/909567636878458880	Barbara102006	0.0
25	Stone Cold	909567635007823872	86	7	40	Trump tweeting himself hitting Hillary with a golf ball making her trip is not funny normal or defensible Ana Navarro pic.twitter.com/Um53s6qDzd	2017-09-17 23:59:57	/stonecold2050/status/909567635007823872	stonecold2050	0.012499999999999997
26	POTUS Watch	909567634710155264	0	0	0	As North Korea threat looms, Trump to address world leaders at U.N. #Trump #news #usa #twitter #cnn #magahttp://www.reuters.com/article/us-un-assembly/as-north-korea-threat-looms-trump-to-address-world-leaders-at-u-n-idUSKCN1BS0WB …	2017-09-17 23:59:57	/POTUSWatch2016/status/909567634710155265	POTUSWatch2016	0.0
27	Verdad 27-N	909567633485438976	0	0	0	¡SE VIENEN MÁS AMENAZAS! Discurso de Donald Trump ante la ONU promete “bofetadas” contra Venezuela #Lechuguinoshttp://ow.ly/6QGp30fdIrs 	2017-09-17 23:59:57	/Verdad27N/status/909567633485438977	Verdad27N	0.0
28	Pablo Arias  🐝	909567633091067904	0	0	0	Quien putas quiere ver a Colbert haciendo los mismos chistes de siempre sobre Trump 	2017-09-17 23:59:57	/ariasPablo94/status/909567633091067904	ariasPablo94	0.0
29	Chris Donovan	909567629781856256	2	0	1	"Trump's past tweets on the #Emmys 
“I should have many Emmys""
“The Emmys have no credibility”
“The Emmys are all politics”https://twitter.com/chrisdonovan/status/909567343495442433 …"	2017-09-17 23:59:56	/chrisdonovan/status/909567629781856256	chrisdonovan	0.125
30	Danger Close USA	909567629727272960	0	0	0	@SheriffClarke A real cowboy knows the wolf before the sheep call it out. You're no real cowboy.. Trump is the wolf, but you sir, the sheep.	2017-09-17 23:59:56	/DangerClose_USA/status/909567629727272960	DangerClose_USA	0.05
31	Jessica Dawson	909567629563535360	1	1	0	#ASKISSATWAIMZ make a song of Donald trump	2017-09-17 23:59:56	/jmxsd/status/909567629563535360	jmxsd	0.0
32	ghosts of blackness	909567625847607296	2	0	0	"What the f*ck would Donald Trump know about the Constitution?
All he's done w/ it so far is use it as toilet paper.

#RemoveTrump and #MAGA"	2017-09-17 23:59:55	/death_to_ether/status/909567625847607296	death_to_ether	0.03333333333333334
33	Exprules gaming	909567625608523776	0	0	0	I liked a @YouTube video http://youtu.be/lLAoYb4Vc_Y?a  Garry's Mod Deathrun Funny Moments! - MEME FACTORY! (Boneless Pizza, Trump, Shrek	2017-09-17 23:59:55	/xprules29/status/909567625608523776	xprules29	0.39687500000000003
34	mexicalirose aka stable genius	909567625570787328	0	1	0	Butts don't swing golf clubs. I mean assholes do...at Trump golf courses.	2017-09-17 23:59:55	/gman_mish/status/909567625570787328	gman_mish	-0.3125
35	Anne-MAGA Illinois  🇺🇸	909567625335853056	6	0	4	pic.twitter.com/5hPvz4gP7F	2017-09-17 23:59:55	/AIllinoi/status/909567625335853056	AIllinoi	0.0
36	JR	909567622441783296	0	5	0	Do you think an actor who voted for Trump might similarly find it hard to get a job in Hollywood?	2017-09-17 23:59:54	/everlong554/status/909567622441783296	everlong554	-0.14583333333333334
37	Sheila Pettiford	954141350856978432	0	0	0	Everything he’s saying about Trump, he’s proven more and more Trump doesn’t have what it takes to be president. That he’s easily swayed by the way you treat him. He’s worse than a woman when it’s her time of the month. https://twitter.com/politicussarah/status/954059674374037504 …	2018-01-18 23:59:59	/SheilaPettifor2/status/954141350856978432	SheilaPettifor2	0.2583333333333333
38	P. B.	954141349212811264	0	0	0	28m adults in Canada.   So 5.6 millions Canadian and 100 million American approve of Trump.  Something to think about...	2018-01-18 23:59:59	/pbernier2011/status/954141349212811264	pbernier2011	0.0
39	Sheldon Kaufman	954141348814360576	1	0	0	"@georgiegirl1216 
Tim Cook's desire to ""Help America"" seems to coincide with the tax advantages Trump engineered."	2018-01-18 23:59:59	/SheldonKaufman/status/954141348814360582	SheldonKaufman	0.0
40	Crystal	954141348071866368	3	3	0	The people who stood behind trump November 8th 2016 will stand behind him again in 2020. No video of rural Americans talking down on him or voicing concerns will change that. Keep trying #FakeNews 	2018-01-18 23:59:59	/CrystalNicole_1/status/954141348071866370	CrystalNicole_1	-0.2388888888888889
41	Linda garris	954141347258294272	0	0	0	"President Trump you make me smile 
Ive been disgusted w govt since Clinton won
Now we have a POTUS who cares abt us& has a sense of humor
I  fake news awards- thank you"	2018-01-18 23:59:58	/linda_garris/status/954141347258294273	linda_garris	-0.39999999999999997
42	David C Heyerman	954141345643347968	7	2	0	You know Trump colluded and I know it; damn the evidence!	2018-01-18 23:59:58	/DHeyerman/status/954141345643347968	DHeyerman	0.0
43	mike mikovich	954141344758484992	0	0	0	Trump and all of us are laughing at you. We are keeping out anti americans like you so #packyourshit and stay in Canada ... butt out of America :)	2018-01-18 23:59:58	/mikemikovich/status/954141344758484994	mikemikovich	0.5
44	Bobby B	954141344594771968	0	0	0	Please enlighten us on the Trump family tree and his meritorious grandfather? And Melania’s so-called ingress into the country was…?	2018-01-18 23:59:58	/BobbyBenveniste/status/954141344594771968	BobbyBenveniste	0.0
45	//Seadog//	954141342581559296	0	0	0	Inside Judicial Watch: The Truth Behind Fusion GPS & The Trump Dossier https://youtu.be/XMTTbRIvMVk  via @YouTube	2018-01-18 23:59:57	/jameswhelms/status/954141342581559298	jameswhelms	-0.4
46	DR JAMES A, PHD 🔵 ⚖ 🕵	954141341885386752	3	1	2	"FAKE NEWS ALERT
MSM reports Stormy Daniels affair was 4 months after Barron Trump born -3/20/06
MSM says Trump asked her to spank him with a Forbes mag w/Ivanka's pic on it. This is the 10/9/06 edition of Forbes. 
THAT'S THREE MONTHS AFTER MSM CLAIMS THE AFFAIR OCCURRED pic.twitter.com/n4Gp5rzp9S"	2018-01-18 23:59:57	/DoRtChristians/status/954141341885386753	DoRtChristians	-0.5
47	GAGirl1967 Release The Memo	954141339935010816	0	0	0	I guess now all We can do is hope trump vetoed it.  I won’t hold my breath.	2018-01-18 23:59:57	/Tamaraw68415067/status/954141339935010816	Tamaraw68415067	0.0
48	wosh u face, wosh u hand, wosh u leg, wosh u SOUL	954141337946918912	0	0	0	That's the same Trump lawyer mentioned at length in the Fusion GPS testimony released today by the House committee that recorded it.	2018-01-18 23:59:56	/rdhesselbrock/status/954141337946918912	rdhesselbrock	0.0
49	Iconic Infidel	954141337766518784	0	0	0	Trump is an embarrassment to the entire PORN INDUSTRY	2018-01-18 23:59:56	/iconic_infidel/status/954141337766518789	iconic_infidel	0.0
50	Michael Edwards	954141337628033024	4	0	1	Can there be any question the Trump administration is racist,  promotes racist views and racist policies? Just another example  and not an isolated one.	2018-01-18 23:59:56	/RomanMikeKam/status/954141337628033024	RomanMikeKam	0.0
51	SuznG	954141337548242944	0	0	0	"Trump’s evangelical advisers abandon him for threatening to deport children 
https://shareblue.com/trumps-evangelical-advisers-abandon-him-for-threatening-to-deport-children/#.WmE077_60ZY.twitter … via @shareblue"	2018-01-18 23:59:56	/therealsuzn/status/954141337548242944	therealsuzn	0.0
52	Integralia	954141336415989760	0	0	1	Hoy en #IntegraliaData: ¿Cómo termina el primer año de presidencia de Trump?  Entérate aquí>  http://bit.ly/2FRkDII pic.twitter.com/CuhtKYBvt3	2018-01-18 23:59:56	/Integralia_Mx/status/954141336415989760	Integralia_Mx	0.0
53	Virgil Van Dyke	844337828154806272	0	1	0	whats with ur trump fetish and why do u trust a conman so much, its baffling how u praise him but say hes draining the swamp	2017-03-21 23:59:59	/BesnerLFC/status/844337828154806273	BesnerLFC	0.2
54	b r a n d o n	843964986624036864	84338	208	43555	"when you find out Tomi Lahren got suspended from her job and Trump is being investigated by the FBI
https://twitter.com/tybrokesign/status/824650151532826624/video/1 …"	2017-03-20 23:18:27	/melaninboi/status/843964986624036865	melaninboi	0.0
55	Ann Coulter	844309971378438144	7857	479	2423	CNN: Trump mentioned Putin 80 times in 2016!  So? Don Lemon mentioned Putin 80 times last night.	2017-03-21 22:09:18	/AnnCoulter/status/844309971378438145	AnnCoulter	0.0
56	Thomas Moore	844204766901276672	4015	7	1552	"Me: Why does Trump keep lying?

Trump supporters: He's not lying, you liberal snowflake. He's just speaking Americanese "	2017-03-21 15:11:15	/Thomas_A_Moore/status/844204766901276673	Thomas_A_Moore	0.0
57	Deirdre Walsh	844296072512114688	255	8	152	"NJ GOP Rep Leonard Lance tells reporters after he met with President Trump/VP Pence, ""I'm a no"" on healthcare bill."	2017-03-21 21:14:04	/deirdrewalshcnn/status/844296072512114688	deirdrewalshcnn	0.0
58	ARM 3mil 2.1%	844337521043689472	8	2	9	Ivanka Trump firm accused of exploiting White House for profit @catscatscatzhttps://www.google.com/amp/amp.usatoday.com/story/99446960/ …	2017-03-21 23:58:46	/adirado29/status/844337521043689472	adirado29	-0.1
59	Darrell Goldrup	844337826728677376	0	1	0	Hey folks... This is what delusional leftist people are like. Sad losers! Trump is great!! https://twitter.com/Claymoor83/status/844289057962254336 …	2017-03-21 23:59:59	/DarrellGoldrup/status/844337826728677376	DarrellGoldrup	0.04999999999999999
60	Daily Express	844336614700670976	5	0	4	WORLD ON THE BRINK: North Korea to launch 'powerful missiles AT ANY MOMENT', US fears #trump http://ln.is/www.express.co.uk/ne/P21tD …pic.twitter.com/hQohSU8Ft0	2017-03-21 23:55:10	/Daily_Express/status/844336614700670976	Daily_Express	0.3
61	Trump Texas	844262703162183680	39	1	36	"#Nevada - Contact your Senators!

Let them know you VOTE, and you expect them to Fully Support President Trump
https://twitter.com/gov/lists/us-senate/members …pic.twitter.com/XF5NfLJ7LH"	2017-03-21 19:01:28	/3lectric5heep/status/844262703162183681	3lectric5heep	0.0
62	Paul Joseph Watson	844319589152493568	4184	289	3170	"Anti-Trump Jewish Man Arrested For Spray-Painting Swastikas On Own Home

ANOTHER fake hate crime! http://www.informationliberation.com/?id=56455 "	2017-03-21 22:47:31	/PrisonPlanet/status/844319589152493568	PrisonPlanet	-0.225
63	Skepacabra	844337826497990656	0	3	0	"You mistake me from Trump. https://www.scientificamerican.com/article/big-gap-between-what-scientists-say-and-americans-think-about-climate-change/ …

That's 13% of all scientists where actual climate sci are a small subset"	2017-03-21 23:59:59	/Skepacabra/status/844337826497990656	Skepacabra	-0.125
64	HuffPost Politics	844336111065481216	60	10	33	Even some GOP governors hate Donald Trump's budget  by @svdate http://huff.to/2nb973B pic.twitter.com/A3r3SiSZ66	2017-03-21 23:53:10	/HuffPostPol/status/844336111065481217	HuffPostPol	-0.8
65	b r a n d o n	843964986624036864	84338	208	43555	"when you find out Tomi Lahren got suspended from her job and Trump is being investigated by the FBI
https://twitter.com/tybrokesign/status/824650151532826624/video/1 …"	2017-03-20 23:18:27	/melaninboi/status/843964986624036865	melaninboi	0.0
66	Anntensity	844311956236521472	1009	64	297	"proper headline SHOULD be:
NUMBER 1 TRUMP SUPPORTER CONTINUES TO KEEP TRUMP ON TRACK 
http://us.blastingnews.com/showbiz-tv/2017/03/ann-coulter-turns-on-donald-trump-during-scathing-twitter-tantrum-001566409.html …"	2017-03-21 22:17:11	/anntensity/status/844311956236521472	anntensity	0.0
67	Queen of the Nerds	844337536952483840	1	0	2	Here's what Jimmy Breslin wrote about Donald Trump decades ago http://nydn.us/2mNrXv4 	2017-03-21 23:58:50	/TheRealDaniYell/status/844337536952483840	TheRealDaniYell	0.0
68	Matea Gold	844295452577206272	529	16	328	First a DC wine bar, now a SF clothing boutique. Expect more suits claiming Trump businesses have unfair advantage. http://wapo.st/2o1R11z?tid=ss_tw …	2017-03-21 21:11:36	/mateagold/status/844295452577206278	mateagold	0.08333333333333333
69	The Colonel	844337825986351104	0	0	2	Schumer: Senate Shouldn't Vote On Gorsuch While FBI Investigates Trump http://fb.me/1Jha9LV58 	2017-03-21 23:59:59	/ryanjharmon/status/844337825986351108	ryanjharmon	0.0
70	K	844337825940230144	0	0	0	Ivanka Trump firm accused of exploiting White House for profit http://usat.ly/2mMCcz2  via @USATODAY	2017-03-21 23:59:59	/buffyfa516/status/844337825940230144	buffyfa516	-0.1
71	ROSIE	844323493814714368	5446	531	2111	how did trump come to hire paul manafort? how did they meet? who thought up paul for that position? anyone? #Trumprussia #treason	2017-03-21 23:03:02	/Rosie/status/844323493814714368	Rosie	0.0
72	TRUMP as POTUS	916815401190875136	0	0	0	Today is 2017-10-07 05:00 PM in LA and Donald J. Trump is still the President.	2017-10-07 23:59:59	/TRMPasPOTUS/status/916815401190875139	TRMPasPOTUS	0.0
73	Jorge A. Mussuto	916815400092028928	0	0	0	Top story: Trump on North Korea: 'Only one thing will work' - CNNPolitics http://www.cnn.com/2017/10/07/politics/trump-north-korea-negotiations-tweet …, see more http://tweetedtimes.com/jmussuto?s=tnp 	2017-10-07 23:59:59	/jmussuto/status/916815400092028929	jmussuto	0.3333333333333333
74	Kathy	916815399043334144	1	0	0	Apparently so was Trump.	2017-10-07 23:59:59	/kherm14/status/916815399043334144	kherm14	0.05
75	Michael Hinsley	916815398619668480	1	0	0	Trump is safe. “The Frigging Moron” is Chaos Personnified. Putins’ Goal In US is Confusion. The Murders Are Simply Housekeeping.	2017-10-07 23:59:59	/chezmichel7/status/916815398619668481	chezmichel7	-0.10000000000000002
76	Melani	916815398078701568	1	1	1	And in this corner it's the  with an IQ of 17. In this corner are some of the brightest minds we have. Trump's fucked	2017-10-07 23:59:59	/Melani_denham/status/916815398078701569	Melani_denham	-0.6
77	Toto	916815397931900928	0	0	0	We all gonna die in the hands of trump	2017-10-07 23:59:59	/Toto_nairesiai/status/916815397931900928	Toto_nairesiai	0.0
78	Derek paul	916815397114056704	3	0	0	So Puerto Rico still suffering NK going to launch nuclear weapons Russia hacks our voting what does trump do? Goes to a rally in NC asshole	2017-10-07 23:59:58	/dpt7401/status/916815397114056704	dpt7401	0.0
79	Gretchen Lewis	916815396921102336	0	0	0	Never have, never will. I refer to him as trump, and always use lower case when typing.	2017-10-07 23:59:58	/glmlewis/status/916815396921102337	glmlewis	0.0
80	Myrna	916815395968995328	0	1	0	Trump is demented and we should all be united in getting him out of office. That would be patriotic!	2017-10-07 23:59:58	/MyrnaDawn/status/916815395968995329	MyrnaDawn	0.0
81	Pat Lee	916815391837564928	0	0	0	All the pussy hats who are feminists, can pay their own way. Else, they are pussies but NOT feminists.	2017-10-07 23:59:57	/Leakers17/status/916815391837564928	Leakers17	0.6
82	William Foos #PEACE and Love	916815389434302464	0	0	0	Trump is going to keep it up with the wall until there's A FUCKING  border war with Mexico spell the fucking coffee Congress!!!!	2017-10-07 23:59:57	/williamFoos2/status/916815389434302466	williamFoos2	-0.8
83	Terri Solares	916815384157634560	1	1	0	When dating do you bluntly ask their political party? It would cause concern about what kind of man would support Trump.	2017-10-07 23:59:55	/TSolares/status/916815384157634560	TSolares	0.3
84	DAVID WILSON	916815384073957376	0	0	0	Trump is the determining factor, and you can keep score by counting those standing behind him...worse, those passing his agenda.	2017-10-07 23:59:55	/DavidWls22/status/916815384073957376	DavidWls22	-0.4
85	Amy Oddo ❄️	916815382849212416	1	0	0	BULLSH**!! It is part of the Pence agenda to push women back to 1950! Trump LOVES birth control! pic.twitter.com/u9F7OUuoYo	2017-10-07 23:59:55	/AmyOddo/status/916815382849212417	AmyOddo	0.0
86	Brian	916815381930668032	0	0	0	"ANOTHER GOLF TRIP FOR THE PERSON WHO SAID""I WON'T BE PLAYING MUCH GOLF""WHAT A LYING ASSHOLE YOU ARE TRUMP!! #LIAR &CHIEF"	2017-10-07 23:59:55	/knowye/status/916815381930668032	knowye	0.3125
87	Wilhelm Vins	916815379623825408	0	0	0	Way more important than gun control: take nuclear control away from Trump! https://twitter.com/thehill/status/916800586896625669 …	2017-10-07 23:59:54	/pitvins/status/916815379623825408	pitvins	0.5
88	outonleave	916815377497280512	0	0	0	Let's face it, we got fucked in the Alternate Universe Sweepstakes. In 1 out of 4,000,000 Multiverses did Trump... http://fb.me/8kKFlmlCE 	2017-10-07 23:59:54	/outonleave00/status/916815377497280512	outonleave00	-0.3
89	Valdar	916815377186799616	0	0	0	I wouldn't be surprised if Trump wins another 4 years, need self-induced coma, wake me up in 2024. https://www.google.com/amp/www.chicagotribune.com/news/opinion/commentary/ct-trump-election-2020-win-20171007-story,amp.html …	2017-10-07 23:59:54	/avfpev/status/916815377186799617	avfpev	0.10000000000000002
90	Cate	916815376666759168	1	0	1	"Trump Ominously Tweets ‘Only One Thing Will Work’ With North Korea

Trump’s only  way out is to start a war.  http://www.huffingtonpost.com/entry/trump-north-korea-only-one-thing-will-work_us_59d939fde4b046f5ad98a952?div …"	2017-10-07 23:59:54	/lavndrblue/status/916815376666759168	lavndrblue	0.0
91	Ann Becker	945806430585704448	0	0	0	The Trump-Less Kennedy Center Honors https://www.nytimes.com/2017/12/25/opinion/kennedy-center-honors-trump.html …	2017-12-26 23:59:59	/travelwAnn/status/945806430585704449	travelwAnn	-0.1
92	TODD PERRY	945806428387889152	0	0	0	Mueller is NOT impartial but anti Trump and PRO hillary! https://www.infowars.com/rep-louie-gohmert-mueller-would-love-to-get-trumps-scalp/ …	2017-12-26 23:59:59	/TODDPERRY3/status/945806428387889153	TODDPERRY3	0.0
93	Resistance Futile!!	945806427301363712	1	0	0	"Flake is aptly named. He is a Snowflake Rino. He is not liked in Az and would lose if he ran for re-election. Flake is the coyote and Trump is the Roadrunner.
RESISTANCE IS FUTILE!!
MAKING AMERICA GREAT AGAIN!!"	2017-12-26 23:59:59	/SillySnowflakes/status/945806427301363712	SillySnowflakes	0.3770833333333334
94	 ❄️ 🌊 🌊Mary 🌊 🌊 ❄️	945806427221843968	0	0	0	In Trump, and your daughter, you, and the rest of the @GOP, we have thieves, liars, and bullshit artists.  And people are sick of it.  But you all keep playing your game. We got you.  2018!	2017-12-26 23:59:59	/JustMaryy/status/945806427221843968	JustMaryy	-0.6071428571428572
